,review_en,review_es,sentiment,sentimiento
35,"I bought this film at Blockbuster for $3.00, because it sounded interesting (a bit Ranma-esque, with the idea of someone dragging around a skeleton), because there was a cute girl in a mini-skirt on the back, and because there was a Restricted Viewing sticker on it. I thought it was going to be a sweet or at least sincere coming of age story with a weird indie edge. I was 100% wrong.Having watched it, I have to wonder how it got the restricted sticker, since there is hardly any foul language, little violence, and the closest thing to nudity (Honestly! I don't usually go around hoping for it!) is when the girl is in her nightgown and you see her panties (you see her panties a lot in this movie, because no matter what, she's wearing a miniskirt of some sort). Even the anti-religious humor is tame (and lame, caricatured, insincere, derivative, unoriginal, and worst of all not funny in the slightest--it would be better just to listen to Ray Stevens' ""Would Jesus Wear a Rolex on His Television Show""). This would barely qualify as PG-13 (it is Not Rated), but Blockbuster refuses to let anyone under the age of 17 rent this--as if it was pornographic. Any little kid could go in there and rent the edited version of Requiem for a Dream, but they insist that Zack and Reba is worse.It is, but not in that way.In a way, this worries me--the only thing left that could offend people is the idea of the suicide at the beginning. If anybody needs to see movies with honestly portrayed suicides (not this one, but better ones like The Virgin Suicides), it's teenagers. If both of those movies were rated R purely because of the suicide aspect, then I have little chance of turning a story I've been writing into a PG-13 movie (the main characters are eleven and a half and twelve). Suicide is one of the top three leading causes of death in teenagers (I think it's number 2), so chances are that most teens have been or will be affected by it.Just say no to this movie, though. 2/10.","Compré esta película en Blockbuster por $ 3.00, porque sonaba interesante (un poco de Ranma-esque, con la idea de que alguien arrastraba alrededor de un esqueleto), porque había una linda chica en una minifalda en la espalda, y porque había Una etiqueta de visualización restringida. Pensé que iba a ser un dulce o al menos sincero historia de edad con un extraño borde indie. Estaba 100% equivocado. La navegación lo vio, tengo que preguntarme cómo consiguió la etiqueta restringida, ya que casi no hay un lenguaje asqueroso, poca violencia, y lo más cercano a la desnudez (honestamente! Normalmente, no sé la esperanza de la esperanza. ¡Es!) Es cuando la niña está en su camisón y ves sus bragas (ves sus bragas mucho en esta película, porque no importa qué, está usando una minifalda de algún tipo). Incluso el humor anti-religioso es domesticado (y cojo, caricaturado, insincero, derivado, poco original y lo peor de todo no divertido en lo más mínimo, sería mejor escuchar a Ray Stevens """" ¿Jesús usaría un Rolex en su Programa de televisión""). Esto apenas calificaría como PG-13 (no está calificado), pero Blockbuster se niega a dejar que cualquier persona menor de 17 años alquile esto, como si fuera pornográfico. Cualquier niño pequeño podría ir allí y alquilar la versión editada de Requiem por un sueño, pero insisten en que Zack y Reba es peor. Es, pero no de esa manera. En cierto modo, esto me preocupa, lo único que queda. Eso podría ofender a las personas es la idea del suicidio al principio. Si alguien necesita ver películas con suicidios honestamente retratados (no esta, pero mejores como los suicidios virgen), son adolescentes. Si ambas de esas películas se calificaron r, simplemente debido al aspecto del suicidio, entonces tengo pocas posibilidades de convertir una historia que he estado escribiendo en una película PG-13 (los personajes principales tienen once y medio y doce). El suicidio es una de las tres principales causas principales de la muerte en adolescentes (creo que es el número 2), por lo que es probable que la mayoría de los adolescentes hayan sido o se verán afectados por él. Sin embargo, diríjase a la película. 2/10.",negative,negativo
36,"The plot is about the death of little children. Hopper is the one who has to investigate the killings. During the movie it appears that he has some troubles with his daughter. In the end the serial killer get caught. That's it. But before you find out who dunnit, you have to see some terrible acting by all of the actors. It is unbelievable how bad these actors are, including Hopper. I could go on like this but that to much of a waste of my time. Just don't watch the movie. I've warned you.","La parcela es sobre la muerte de los niños pequeños.La tolva es la que tiene que investigar los asesinatos.Durante la película, parece que tiene algunos problemas con su hija.Al final, el asesino en serie se captura.Eso es.Pero antes de descubrir quién se dunnit, tienes que ver un actor terrible por parte de todos los actores.Es increíble lo mal que son estos actores, incluida la tolva.Podría seguir así, pero eso a gran pérdida de mi tiempo.Simplemente no veas la película.Te he advertido.",negative,negativo
37,"Ever watched a movie that lost the plot? Well, this didn't even really have one to begin with.Where to begin? The achingly tedious scenes of our heroine sitting around the house with actually no sense of menace or even foreboding created even during the apparently constant thunderstorms (that are strangely never actually heard in the house-great double glazing)? The house that is apparently only a few miles from a town yet is several hours walk away(?) or the third girl who serves no purpose to the plot except to provide a surprisingly quick gory murder just as the tedium becomes unbearable? Or even the beginning which suggests a spate of 20+ killings throughout the area even though it is apparent the killer never ventures far from the house? Or the bizarre ritual with the salt & pepper that pretty much sums up most of the films inherent lack of direction.Add a lead actress who can't act but at least is willing to do some completely irrelevant nude shower scenes and this video is truly nasty, but not in the way you hope.Given a following simply for being banned in the UK in the 80's (mostly because of a final surprisingly over extended murder) it offers nothing but curiosity value- and one classic 'daft' murder (don't worry-its telegraphed at least ten minutes before).After a walk in the woods our victim comes to a rather steep upward slope which they obviously struggle up. Halfway through they see a figure at the top dressed in black and brandishing a large scythe. What do they do? Slide down and run like the rest of us? No, of course not- they struggle to the top and stand conveniently nice and upright in front of the murder weapon.It really IS only a movie as they say..","¿Alguna vez vio una película que perdió la parcela? Bueno, esto ni siquiera realmente tenía uno para empezar. ¿Dónde empezar? Las escenas anudosas de nuestra heroína sentada alrededor de la casa con en realidad no hay sensación de amenaza o incluso presentimiento creado incluso durante las tormentas eléctricas aparentemente constantes (que nunca se escuchan extrañamente en la casa, ¡un gran doble acristalamiento)? La casa que aparentemente está a solo unos kilómetros de una ciudad, ¡ya se encuentra a varias horas a pie (?) O la tercera chica que no tiene ningún propósito para la trama, excepto para proporcionar un asesinato sorprendentemente rápido de Gory, así como el tedio se vuelve insoportable. O incluso el comienzo, lo que sugiere una pala de más de 20 asesinatos en todo el área, a pesar de que es evidente que el asesino nunca se aventura lejos de la casa. O el extraño ritual con la sal y la pimienta que casi resume la mayoría de las películas inherentes la falta de dirección. Añadir una actriz principal que no puede actuar, pero al menos está dispuesta a hacer algunas escenas de ducha desnuda completamente irrelevantes y este video es verdaderamente Desagrad, pero no en la forma en que esperas. A continuación, simplemente por ser prohibido en el Reino Unido en los años 80 (principalmente debido a un último asesinato sorprendentemente sobre extendido), no ofrece nada más que valor de curiosidad y un asesinato de 'Daft' clásico (DON No se preocupe, su telegrafiado al menos diez minutos antes). Después de un paseo por el bosque, nuestra víctima llega a una pendiente ascendente bastante empinada que obviamente luchan. A mitad de camino, ve una figura en la parte superior vestida de negro y blandiendo una guadaña grande. ¿Qué hacen? Deslice hacia abajo y corre como el resto de nosotros? No, por supuesto, no, luchan contra la cima y se paran cómodamente agradables y erguidas frente al arma del asesinato. Realmente es solo una película como dicen ..",negative,negativo
38,"Okay, so this series kind of takes the route of 'here we go again!' Week in, week out David Morse's character helps out his ride who is in a bit of a pickle - but what's wrong with that!? David Morse is one of the greatest character actors out there, and certainly the coolest, and to have him in a series created by David Koepp - a great writer - is heaven!!Due to the lack of love for this show by many, I can't see it going to a season series - but you never know? The amount of rubbish that has made it beyond that baffles me - let's hope something good can make it past a first series!!!","Bueno, ¡así que esta serie es una especie de camino de 'aquí vamos otra vez!'La semana, la semana, el personaje de David Morse ayuda a salir de su viaje, que está en un poco de pepinillo, pero ¿qué está mal con eso?David Morse es uno de los mejores actores de los personajes por ahí, y ciertamente lo más fresco, y para tenerlo en una serie creado por David Koepp, un gran escritor, ¿es el cielo? Debido a la falta de amor por este espectáculo por muchos, yoNo puedo verlo ir a una serie de temporada, ¡pero nunca lo sabes?La cantidad de basura que lo ha hecho más allá de lo que me desconcierta, ¡esperemos que algo bueno pueda pasar una primera serie!",positive,positivo
39,"After sitting through this pile of dung, my husband and I wondered whether it was actually the product of an experiment to see whether a computer program could produce a movie. It was that listless and formulaic. But the U.S. propaganda thrown in your face throughout the film proves--disappointingly--that it's the work of humans. Call me a conspiracy theorist, but quotes like, ""We have to steal the Declaration of Independence to protect it"" seem like ways to justify actions like the invasion of Iraq, etc. The fact that Nicholas Cage spews lines like, ""I would never use the Declaration of Independence as a bargaining chip"" with a straight face made me and my husband wonder whether the entire cast took Valium before shooting each scene. The ""reasoning"" behind each plot turn and new ""clue"" is truly ridiculous and impossible to follow. And there's also a bonus side plot of misogyny, with Dr. Whatever-Her-Name-Was being chided by all involved for ""never shutting up."" She's clearly in the movie only for looks, but they felt the need to slap a ""Dr."" title on her character to give her some gravity. At one point, Cage's character says, ""Don't you ever shut up?"" and the camera pans to her looking poutily down at her hands, like she's a child. Truly grotesque. The only benefit to this movie was that it's so astonishingly bad, you do get a few laughs out of it. The really scary thing is that a majority of the people watching the movie with us seemed to enjoy it. Creepy....","Después de sentarse a través de esta pila de estiércol, mi esposo y yo nos preguntamos si en realidad era el producto de un experimento para ver si un programa de computadora podría producir una película. Fue apático y fórmulo. Pero la propaganda de los Estados Unidos lanzada en su cara a lo largo de la película demuestra, decepcionantemente, que es la obra de los humanos. Llámame un teórico de la conspiración, pero cita como: ""Tenemos que robar la Declaración de la Independencia para protegerla"" Parece que las formas de justificar las acciones como la invasión de Irak, etc. El hecho de que Nicholas Jage le gustó "", nunca lo haría Use la Declaración de Independencia como un chip de negociación ""con una cara recta me hizo preguntarme a mi esposo si todo el reparto tomó a Valium antes de disparar cada escena. El ""razonamiento"" detrás de cada giro de la parcela y la nueva ""pista"" es verdaderamente ridícula e imposible de seguir. Y también hay una parcela lateral de misoginia, con el Dr. Whinche, su nombre, fue siendo reprendido por todos los involucrados para ""nunca cerrarse"". Ella está claramente en la película solo para las miradas, pero sentían la necesidad de abofetear un ""Dr."" Título sobre su carácter para darle algo de gravedad. En un momento dado, el personaje de CAGE dice: ""¿Nunca te callas?"" Y la cámara se siente a ella mirando a sus manos, como si fuera un niño. Verdaderamente grotesco. El único beneficio para esta película fue que es tan sorprendentemente malo, obtienes algunas risas de ella. La cosa realmente aterradora es que la mayoría de las personas que ven la película con nosotros parecían disfrutarla. Espeluznante....",negative,negativo
40,"It had all the clichés of movies of this type and no substance. The plot went nowhere and at the end of the movie I felt like a sucker for watching it. The production was good; however, the script and acting were B-movie quality. The casting was poor because there were good actors mixed in with crumby actors. The good actors didn't hold their own nor did they lift up the others. This movie is not worthy of more words, but I will say more to meet the minimum requirement of ten lines. James Wood and Cuba Gooding, Jr. play caricatures of themselves in other movies. If you are looking for mindless entertainment, I still wouldn't recommend this movie.","Tenía todos los clichés de las películas de este tipo y ninguna sustancia.La trama no se fue a ninguna parte y al final de la película me sentí como un lechón para observarlo.La producción fue buena;Sin embargo, el guión y la actuación fueron la calidad de la película B.El casting era pobre porque había buenos actores mezclados con los actores de crumby.Los buenos actores no sostuvieron los suyos ni alejaron a los demás.Esta película no es digna de más palabras, pero diré más para satisfacer el requisito mínimo de diez líneas.James Wood y Cuba Goinging, Jr. juegan caricaturas de sí mismas en otras películas.Si está buscando entretenimiento sin sentido, todavía no recomendaría esta película.",negative,negativo
41,"This movie is based on the book, ""A Many Splendored Thing"" by Han Suyin and tackles issues of race relations between Asians and Whites, a topic that comes from Han's personal experiences as an Eurasian growing up in China. That background, and the beautiful Hong Kong settings, gives this love story a unique and rather daring atmosphere for its time.Other than that, the story is a stereotypical romance with a memorable song that is perhaps more remembered than the movie itself. The beautiful Jennifer Jones looks the part and gives a wonderful, Oscar nominated performance as a doctor of mixed breed during the advent of Communism in mainland China. William Holden never looked better playing a romantic lead as a journalist covering war torn regions in the world. The acting is top notch, and the chemistry between the two lovers provides for some genuine moments of silver screen affection sure to melt the hearts of those who are romantically inclined.The cinematography really brings out fifty's Hong Kong, especially the hilltop overlooking the harbor where the two lovers spend their most intimate moments. The ending is a real tear-jerker. Some may consider sentimental romances passé, but, for those who enjoy classic Hollywood love stories, this is a shining example.","Esta película se basa en el libro, ""Una cosa esplendora"" de Han Suyin y aborda los problemas de las relaciones raciales entre los asiáticos y los blancos, un tema que proviene de las experiencias personales de Han como un eurasiático que crece en China. Ese antecedentes, y la hermosa configuración de Hong Kong, le da a esta historia de amor un ambiente único y bastante atrevido por su tiempo. PERMANENTE que eso, la historia es un romance estereotipado con una canción memorable que quizás sea más recordada que la película en sí. La hermosa Jennifer Jones mira la parte y da un maravilloso desempeño nominado al Oscar como médico de raza mixta durante la llegada del comunismo en China continental. William Holden nunca se veía mejor jugando una ventaja romántica como periodista que cubre las regiones rasgadas de la guerra en el mundo. La actuación es de primera categoría, y la química entre los dos amantes proporciona algunos momentos genuinos de afecto de la pantalla de plata, seguro que se derretirá los corazones de los que se inclinan románticamente. La cinematografía realmente aporta a Fifty's Hong Kong, especialmente la cima de la colina con vistas al puerto donde Los dos amantes pasan sus momentos más íntimos. El final es un verdadero lagrimonio. Algunos pueden considerar los romances sentimentales passé, pero, para aquellos que disfrutan de las historias de amor clásicas de Hollywood, este es un ejemplo brillante.",positive,positivo
42,"Of all the films I have seen, this one, The Rage, has got to be one of the worst yet. The direction, LOGIC, continuity, changes in plot-script and dialog made me cry out in pain. ""How could ANYONE come up with something so crappy""? Gary Busey is know for his ""B"" movies, but this is a sure ""W"" movie. (W=waste).Take for example: about two dozen FBI & local law officers surround a trailer house with a jeep wagoneer. Inside the jeep is MA and is ""confused"" as to why all the cops are about. Within seconds a huge gun battle ensues, MA being killed straight off. The cops blast away at the jeep with gary and company blasting away at them. The cops fall like dominoes and the jeep with Gary drives around in circles and are not hit by one single bullet/pellet. MA is killed and gary seems to not to have noticed-damn that guy is tough. Truly a miracle, not since the six-shooter held 300 bullets has there been such a miracle.","De todas las películas que he visto, esta, la rabia, tiene que ser una de las peores más peores.La dirección, la lógica, la continuidad, los cambios en el script de parcela y el diálogo me hicieron gritar de dolor.""¿Cómo podría alguien venir con algo tan crapado""?Gary Busey es conocido por sus películas ""B"", pero esta es una película ""W"" segura.(W = residuos). Trake, por ejemplo: alrededor de dos docenas de oficiales de la ley del FBI y las leyes locales rodean una casa de remolque con un jeep wagoneer.Dentro del Jeep es MA y está ""confundido"" en cuanto a por qué se trata todos los policías.En cuestión de segundos, se produce una enorme batalla de armas, Má siendo matado directamente.Los policías se despliegan en el jeep con Gary y la compañía que los estaban volando.Los policías caen como dominó y el jeep con Gary accionan alrededor de círculos y no son golpeados por una sola bala / pellet.MA está matado y Gary parece no haber notado: Maldita sea, ese tipo es duro.Verdaderamente un milagro, no desde que los seis disparadores celebraron 300 balas, ha habido un milagro.",negative,negativo
43,"I had heard good things about ""States of Grace"" and came in with an open mind. I thought that ""God's Army"" was okay, and I thought that maybe Dutcher had improved and matured as a filmmaker. The film began with some shaky acting, and I thought, ""well, maybe it will get better."" Unfortunately, it never did. The picture starts out by introducing two elders -- Mormon missionaries -- and it seems that the audience will get to know them and grow to care about them. Instead, the story degenerates into a highly improbable series of unfortunate events highlighting blatant disobedience by the missionaries (something that undeniably exists, but rarely on the level that Dutcher portrays) and it becomes almost laughable.Dutcher's only success in this movie is his successful alienation of his target audience. By unrealistically and inaccurately portraying the lives of Mormon missionaries, Dutcher accomplishes nothing more than angering his predominantly Mormon audience. The film in no way reflects reality. Missions are nothing like what Dutcher shows (having served a Mormon mission myself I can attest to this fact) and gang life in California certainly contains much more explicit language than the occasional mild vulgarity.The conclusion, which I'm assuming was supposed to touch the audience and inspire them to believe that forgiveness is available to all, was both unbelievable (c'mon, the entire mission gathers to see this elder sent home -- and the mom and the girl are standing right next to each other!) and cheesy. Next time, Dutcher, try making a movie that SOMEONE can identify with.","Había escuchado cosas buenas sobre ""estados de gracia"" y entró con una mente abierta. Pensé que ""el ejército de Dios"" estaba bien, y pensé que tal vez Dunescler había mejorado y madurado como cineasta. La película comenzó con una actuación temblorosa, y pensé: ""Bueno, tal vez será mejor"". Desafortunadamente, nunca lo hizo. La imagen comienza por introducir dos misioneros de ancianos: misioneros mormones, y parece que la audiencia les conozca y crecerá para preocuparse por ellos. En su lugar, la historia se degenera en una serie altamente improbable de desafortunados eventos que destacan la desobediencia flagrante por parte de los misioneros (algo que existe sin duda, pero rara vez en el nivel que repagua Duthercher) y se vuelve casi risas. El único éxito de putcher en esta película es su exitosa alienación. de su público objetivo. Al retratar de manera irreal e inexactitud la vida de los misioneros mormones, Duthercher no logra nada más que enojar a su audiencia predominantemente mormona. La película de ninguna manera refleja la realidad. Las misiones no son nada como lo que Dutcher Shows (habiendo servido a una mística mormona, yo puedo atestiguar este hecho) y la vida de pandillas en California ciertamente contiene un lenguaje mucho más explícito que la ocasional vulgaridad leve. La conclusión, que estoy asumiendo que debía tocar. La audiencia e inspirarlos a creer que el perdón está disponible para todos, fue increíble (vamos, toda la misión se reúne para ver a este anciano enviado a casa, ¡y la mamá y la niña están de pie justo al lado del otro!) Y caseoso. La próxima vez, Dutcher, intenta hacer una película con la que alguien pueda identificarse.",negative,negativo
44,"This movie struck home for me. Being 29, I remember the '80's and my father working in a factory. I figured, if I worked hard too, if I had pride and never gave up I too could have the American Dream, the house, a few kids, a car all to call my own. I've noted however, without a degree in something (unlike my father that quit at ninth grade) and a keen sense of greed and laziness, you can't get anywhere.I would like to know if anyone has this movie on DVD or VHS. it's made for TV, and I just saw it an hour ago. Ic an't find it anywhere! I'd love to show this to my friends, my pseudo friends, family and other relatives, see what they think and remind them that once upon a time, Americans WOULD work for the sake of feeling honor and that we had pride in what we accomplished!! I think the feeling is still there, but in a heavy downward spiral with so many things being made overseas...","Esta película golpeó a casa por mí.Siendo 29, recuerdo los '80 y mi padre trabajando en una fábrica.También pensé, si hubiera trabajado duro también, si me enorgullecía y nunca me rendí, yo también podría tener el sueño americano, la casa, algunos niños, un automóvil que lo llame.Sin embargo, he notado, sin título en algo (a diferencia de mi padre que renunció en el noveno grado) y un agudo sentido de la codicia y la pereza, no puede obtener a ningún lado. Me gustaría saber si alguien tiene esta película en DVD oVhs.Está hecho para la televisión, y acabo de verlo hace una hora.¡No puedo encontrarlo por ninguna parte!Me encantaría mostrarle esto a mis amigos, mis pseudos amigos, familiares y otros familiares, ven lo que piensan y recuérdales que una vez, los estadounidenses trabajarían por el bien de sentirse honor y que nos enorgullecimos de lo que nosotros¡¡logrado!!Creo que la sensación sigue ahí, pero en una espiral pesada hacia abajo con tantas cosas que se hacen en el extranjero ...",positive,positivo
