,review_en,review_es,sentiment,sentimiento
74,"Upon viewing Tobe Hooper's gem, Crocodile, in 2000, I developed a great interest in the college/crocodile niche of the exploitation/monster genre. I look forward to a wayward producer to follow up with several sequels to these delightful bonbons of camp goodness. If only Ed Wood could bring his subtle sense of flair and dignity to these remarkable scripts. With Ed writing the scripts, and a room full of monkees creating crocodile special effects on a computer, all we'd need would be a cast of crocky fodder with Russ Meyer breasts and Ren Hoek pectoral implants.While Tobe Hooper's crocky opus referenced his own movies, Blood Surf chose to dish out a bunch of aging themes from the chum bucket of other movies. See if you can look past the Revenge of the Nerds sequel sets to find the allusions/homages?/rip-offs to Jaws, Temple of Doom, Indiana Jones' Last Crusade, The Convent, Godzilla 2000, and any James Bond movie. Also, try to find the ready-for-tv fade where the editor gave up on making sense of the stock.I was disappointed the crock didn't get to try out its sotto voce tenor with a soliloquy on environmentalism...or crocky appreciation, but the quasi-Captain Ahab of the story does get his tour de force speach. Perhaps, in the coming years, we'll see a crock galloping off after a shootout into a golden sunset. Or hopefully, a monkey will flush a crocky down the toilet of an international space station for midgets and enjoy the exploitative waltz of zero-G monkey/midget/crocodile bloodshed.All-in-all, the lack of a whammy bar in the surf music irked me.","Al ver la gema de Tober Hooper, el cocodrilo, en 2000, desarrollé un gran interés en el nicho de la universidad / cocodrilo del género de explotación / monstruo. Espero un productor accidental para hacer un seguimiento con varias secuelas a estos deliciosos bombones de la bondad del campamento. Si solo la madera de ED podría llevar su sutil sentido de estilo y dignidad a estos notables scripts. Con ED escribiendo los scripts, y una habitación llena de monos creando efectos especiales de cocodrilo en una computadora, todo lo que necesitaríamos sería un elenco de Crocky Fodder con Russ Meyer senos y los implantes pectorales de Ren Hoek. Mientras que Tobe Hooper's Crocky Opus se le hizo referencia. Las películas, la navegación de sangre optó por sacar un montón de temas de envejecimiento desde el cubo de Chum de otras películas. ¡A ver si puedes mirar más allá de la venganza de los conjuntos de secuelas de nerds para encontrar las alusiones / homes de los homenajes a las mandíbulas, el templo de Doom, la última Crusade de Indiana Jones, el convento, Godzilla 2000 y cualquier película de James Bond. Además, trate de encontrar el desvanecimiento listo para la televisión donde el editor se rindió en la sensación de la acción. Estaba decepcionado. La Crock no llegó a probar su tenor Sotto Voce con un soliloquio en el ecologismo ... o Crocky Apreciación, pero el cuasi-capitán AHAB de la historia hace que su gira de fuerza. Tal vez, en los próximos años, veremos un crock galopando después de un tiroteo en una puesta de sol dorada. O, con suerte, un mono saldrá de un crocky en el inodoro de una estación espacial internacional para los enanos y disfrute de la explotadora vals de mono-g de cero / enano / cocodrilo de sangre derramada. Todas en -La, la falta de una barra desnuda en el surf. La música me molestó.",negative,negativo
75,"It tries to be the epic adventure of the century. And with a cast like Shô Kasugi, Christopher Lee and John-Rhys Davies it really is the perfect B-adventure of all time. It's actually is a pretty fun, swashbuckling adventure that, even with it's flaws, captures your interest. It must have felt as the biggest movie ever for the people who made it. Even if it's made in the 90s, it doesn't have a modern feel. It more has the same feeling that a old Errol Flynn movie had. Big adventure movie are again the big thing in Hollywood but I'm afraid that the feeling in them will never be the same as these old movies had. This on the other hand, just has the real feeling. You just can't hate it. I think it's an okay adventure movie. And I really love the soundtrack. Damn, I want the theme song.","Intenta ser la aventura épica del siglo.Y con un elenco como Shô Kasugi, Christopher Lee y John-Rhys Davies, realmente es la aventura B perfecta de todos los tiempos.En realidad, es una aventura bastante divertida, de swashbuckling que, incluso con sus defectos, captura su interés.Debe haber sentido como la mayor película para las personas que lo hicieron.Incluso si se hace en los años 90, no tiene una sensación moderna.Más tiene la misma sensación de que había una antigua película de Errol Flynn.La película de la gran aventura es de nuevo la gran cosa en Hollywood, pero me temo que la sensación de ellos nunca será la misma que las antiguas películas.Esto por otro lado, solo tiene la sensación real.Simplemente no puedes odiarlo.Creo que es una película de buenas aventuras.Y realmente me encanta la banda sonora.Maldita sea, quiero la canción temática.",positive,positivo
76,"The Last Hard Men finds James Coburn an outlaw doing a long sentence breaking free from a chain gang. Do he and his friends head for the Mexican border from jail and safety. No they don't because Coburn has a mission of revenge. To kill the peace officer who brought him in and in the process killed his woman.That peace officer is Charlton Heston who is now retired and he knows what Coburn is after. As he explains it to his daughter, Barbara Hershey, Coburn was holed up in a shack and was involved in a Waco like standoff. His Indian woman was killed in the hail of bullets fired. It's not something he's proud of, she was a collateral casualty in a manhunt.Lest we feel sorry for Coburn he lets us know full well what an evil man he truly is. Heston is his usual stalwart hero, but the acting honors in The Last Hard Men go to James Coburn. He blows everyone else off the screen when he's on. Coburn gets the bright idea of making sure Heston trails him by kidnapping Hershey and taking her to an Indian reservation where the white authorities can't touch him. He knows that Heston has to make it personal then.Coburn's gang includes, Morgan Paull, Thalmus Rasulala, John Quade, Larry Wilcox, and Jorge Rivero. Heston has Chris Mitchum along who is his son-in-law to be.The Last Hard Men is one nasty and brutal western. Andrew McLaglen directed it and I'm thinking it may have been a project originally intended for Sam Peckinpaugh. It sure shows a lot of his influence with the liberal use of slow motion to accentuate the violence. Of which there is a lot. For a little Peckinpaugh lite, The Last Hard Men is your film.","Los últimos hombres duros encuentran a James Coburn un Outlaw haciendo una larga oración libre de una pandilla de cadena. Hace, él y sus amigos se dirigen a la frontera mexicana de la cárcel y la seguridad. No, no porque Coburn tiene una misión de venganza. Para matar al oficial de la paz que lo trajo y en el proceso mató a su mujer. El oficial de la paz es Charlton Heston, quien ahora está retirado y él sabe qué es Coburn después. Mientras lo explica a su hija, Barbara Hershey, Coburn se agachó en una choza y estaba involucrado en un Waco como un enfrentamiento. Su mujer india fue asesinada en el granizo de balas disparadas. No es algo de lo que esté orgulloso, era una víctima colateral en un manhunt.lest, sentimos pena por Coburn, nos permite saber bien lo que realmente es un hombre malvado. Heston es su habitual héroe de Stalwart, pero los honores de actuación en los últimos hombres duros van a James Coburn. Él sopla a todos los demás de la pantalla cuando está encendido. Coburn obtiene la brillante idea de asegurarse de que Heston lo sortee al secuestrar a Hershey y llevarla a una reserva india donde las autoridades blancas no pueden tocarlo. Él sabe que Heston tiene que hacerlo personal entonces. La pandilla de Coburn incluye, Morgan Paull, Thalmus Rasulala, John Quade, Larry Wilcox y Jorge Rivero. Heston tiene a Chris Mitchum a lo largo de quién es su yerno. Los últimos hombres duros son un occidental desagradable y brutal. Andrew Mclaglen lo dirigió y estoy pensando que puede haber sido un proyecto originalmente destinado a Sam Peckinpaugh. Seguro que muestra mucha influencia con el uso liberal de la cámara lenta para acentuar la violencia. De los cuales hay mucho. Para un pequeño Peckinpaugh Lite, los últimos hombres duros son tu película.",positive,positivo
77,"Maybe it was the title, or the trailer (certainly not the interview on the DVD, which is with the director as he keeps saying ""hi, kids"" into the camera like a buffoon), but I had expectations for Entrails of a Virgin to be at least a bit of sleazy fun with some good sex scenes and brutal, bloody killings by a weird Japanese penetrator. Turns out it's way too sleazy for its own good, or bad, or whatever. There's a problem- and one can see this also in the Italian sexploitation flick Porno Holocaust, similar to this in many respects- in not having balance to the sex and violence. Too much sex and it will turn into a prototypical porno, and not even with much production quality in comparison with most professional porno movies! And with the killing scenes, there has to be at least a little tack, and maybe just a smidgen of ingenuity, in creating the creature/killer/whatever. Entrails of a Virgin has neither. It's safe to say it's a pretty soulless movie, even if isn't one of the very worst ever made- it's there just for horn-dog Japanese fetishists to get off on girls in trouble and men who have all their brains in their 'other' heads.In this case, we're given a photo team where the guys are taking some shots of some girls, nothing too salacious, and then by way of a dense fog they stay off at some house one night and are picked off one by one by ""A Murderer"" as he's credited. First off, the director Kazuo 'Gaira' Komizu decides he has to put in a quota of random sex scenes early on- we get spliced in (or phoned in, take your pick) clips of one of the photographers having sex with one or more of the girls elsewhere. It looks like it's from another movie. Then once settled into the house, there's a 'wrestling' scene that's poorly choreographed and shot (yeah, we really need to see him 'all' there), and then on to the rape and killings. First the rape, by the photographers, who promise the girls some jobs for their time. Then the Murderer, who like D'Amato's creature is simply covered in mud and given a stupid facial, and who for an unknown reason kills the men and/or rapes the women one by one.Now, the latter of those, taken by themselves, should be considered the highlights of the movie. This is like saying, however, that the croûtons are the best part of a wretchedly tasting salad. An eye-gouging scene, a spike thrown like an Olympic event (that scene, actually, is kind of cool), and finally the entrailing of the overly sex-crazed girl, whose inconsequential name I can't remember. Even *this* becomes disappointing just by not being correct to the title! On top of this, the sex scenes, which become tedious through 'Gaira' and his indulgence in long-takes-without-cutaways where everything by the Japanese censors is blurred anyway, are dubbed over by the actors (you'd think that they seem to be enjoying themselves enough, hence the need to let them 'speak' for themselves). But the overall feeling from Entrails of a Virgin is that of a lumpy one, where it's just there to be gawked at and without a shred of suspense or true horror (watch as the last girl left alive, the virgin of the picture, tries to stop the murderer from getting to her, which lasts five minutes as she keeps throwing sticks at him!) You just want it to be done with, for the 'I hate women' mantra to ease up or be rid altogether.","Tal vez fue el título, o el trailer (ciertamente no la entrevista en el DVD, que es con el director como sigue diciendo ""Hola, niños"" en la cámara como un bufón), pero tuve expectativas para las entrañas de una virgen Tenga al menos un poco de diversión sleaz con algunas buenas escenas de sexo y asesinatos brutales y sangrientos por un penetrador japonés extraño. Resulta que es demasiado escozy para su propio bien, o malo, o lo que sea. Hay un problema, y ​​uno puede ver esto también en el holocausto de porno de flick de sexo italiano, similar a esto en muchos aspectos, al no tener equilibrio al sexo y la violencia. Demasiado sexo y se convertirá en un porno prototípico, ¡y ni siquiera con mucha calidad de producción en comparación con la mayoría de las películas de porno profesional! Y con las escenas de asesinato, tiene que haber al menos un poco de lado, y tal vez solo un smidgen de ingenio, al crear la criatura / asesino / lo que sea. Las entrañas de una virgen no tienen ninguno. Es seguro decir que es una película bastante sin alma, incluso si no es una de las más peores que haya hecho, está ahí solo para que los fetichistas japoneses del perro de cuernos se despegan con las niñas en problemas y los hombres que tienen todos sus cerebros en su ""otro. 'Encabezas. En este caso, nos dieron un equipo de fotos donde los muchachos están tomando algunas tomas de algunas niñas, nada demasiado salaces, y luego, por una densa niebla, se quedan fuera de una casa una noche y son escogidos de uno. por uno por ""un asesino"" como ha acreditado. En primer lugar, el director Kazuo 'Gaira' Komizu decide que tiene que poner en una cuota de escenas de sexo al azar desde el principio, nos empalmamos en (o llamamos, tome su selección) clips de uno de los fotógrafos que tienen relaciones sexuales con uno o más de las chicas en otros lugares. Parece que es de otra película. Luego, una vez se estableció en la casa, hay una escena de ""lucha"" que está mal coreografiada y disparada (sí, realmente necesitamos verlo ""allí"" allí), y luego a la violación y los asesinatos. Primero la violación, por los fotógrafos, que prometen a las niñas algunos trabajos por su tiempo. Luego, el asesino, a quien le gusta la criatura de D'Amato simplemente está cubierta de barro y se le da un estúpido facial, y que por una razón desconocida mata a los hombres y / o violan a las mujeres una de una. Ahora, este último de los, tomada por sí mismos. , deben considerarse los puntos destacados de la película. Esto es como decir, sin embargo, que los croûtons son la mejor parte de una ensalada de sabor de sabor. Una escena de las gargantes, una espiga lanzada como un evento olímpico (esa escena, en realidad, es un poco genial), y finalmente la entrada de la chica demasiado sexual, cuyo nombre intrascendente no puedo recordar. Incluso * Esto * se vuelve decepcionante solo por no ser correcto para el título! Además de esto, las escenas de sexo, que se vuelven tediosas a través de 'Gaira' y su indulgencia en largos adquisiciones, donde todos los censores japoneses están borrados de todos modos, son apodados por los actores (pensarías que ellos Parece estar disfrutando lo suficiente, de ahí la necesidad de dejarlos ""hablar"" por sí mismos). Pero el sentimiento general de las entrañas de una virgen es el de un grumoso, donde solo está allí para que esté gawked en y sin un triturador de suspenso o verdadero horror (ver como la última niña, la virgen de la imagen, intenta ¡Detenle que el asesino llegue a ella, lo que dura cinco minutos, ya que ella sigue lanzando palos en él!) Sólo quieres que termine con él, ya que el mantra 'odio a las mujeres' se alivie o se libra por completo.",negative,negativo
78,"The few scenes that actually attempt a depiction of revolutionary struggle resemble a hirsute Boy Scout troop meandering tentatively between swimming holes. When Sharif or, please God, Palance try their hand at fiery oratory, they sound like Kurtz swallowing a bug. The displays of strategic brilliance incorporate a map of Cuba replete with smiling fishies in the ocean, and a positively Vaudevillian hypothesis on how the Bay of Pigs came to pass. What does that leave us with? One comical dentistry scene; a surfeit of uppity Hollywood peasants who address the camera as though it were a moving train; and, just for kicks, a passel of homoeroticism that is not limited to Castro's manic and unremitting cigar-fellatio. Never trust a Medved, but even a busted clock is right twice a day: this is a HISTORICALLY awful movie.","Las pocas escenas que realmente intentan una representación de la lucha revolucionaria se asemeja a una tropa de Hirsute Boy Scout serpenteando tentativamente entre los agujeros de natación.Cuando Sharif o, por favor, Dios, la pálida, prueba su mano en Fiery Oratory, suenan como Kurtz tragando un error.Las exhibiciones de Brilliance estratégica incorporan un mapa de Cuba repleto de peces sonrientes en el océano, y una hipótesis positiva vodevilliana sobre cómo llegaron a pasar la bahía de los cerdos.¿Qué nos deja eso?Una escena de odontología cómica;un surfeit de campesinos de la altura de Hollywood que abordan la cámara como si fuera un tren en movimiento;Y, solo para patadas, un pase de homoerotismo que no se limita a la felación de cigarros maníaco y sin remanso de Castro.Nunca confíe en un medicamento, pero incluso un reloj roto tiene razón dos veces al día: esta es una película históricamente horrible.",negative,negativo
79,"This film took me by surprise. I make it a habit of finding out as little as possible about films before attending because trailers and reviews provide spoiler after spoiler. All I knew upon entering the theater is that it was a documentary about a long married couple and that IMDb readers gave it a 7.8, Rotten Tomatoes users ranked it at 7.9 and the critics averaged an amazing 8.2! If anything, they UNDERRATED this little gem.Filmmaker Doug Block decided to record his parents ""for posterity"" and at the beginning of the film we are treated to the requisite interviews with his parents, outspoken mother Mina, and less than forthcoming dad, Mike. I immediately found this couple interesting and had no idea where the filmmaker (Mike & Mina's son Doug) was going to take us. As a matter of fact, I doubt that Doug himself knew where he was going with this!Life takes unexpected twists and turns and this beautifully expressive film follows the journey. It is difficult to verbalize just how moved I was with this story and the unique way in which it was told. Absolutely riveting from beginning to end and it really is a must-see even if you aren't a fan of the documentary genre. This film will make you think of your own life and might even evoke memories that you thought were long forgotten. ""51 Birch Street"" is one of those rare filmgoing experiences that makes a deep impression and never leaves you. The best news of all is that HBO had a hand in the production so instead of playing to a limited art house audience, eventually, millions of people will have a chance to view this incredible piece of work. BRAVO!!!!!!!!","Esta película me tomó por sorpresa. Tengo la costumbre de descubrir lo menos posible sobre las películas antes de asistir porque los remolques y las reseñas proporcionan alerón después de los spoiler. Todo lo que sabía al ingresar al teatro es que era un documental sobre una pareja casada larga y que los lectores IMDb le dieron un 7.8, los usuarios de tomates podridos lo clasificaron a las 7.9 y los críticos promediaron un asombroso 8.2! En todo caso, se subestablecieron esta pequeña gema. El bloqueo Doug Doug decidió registrar a sus padres ""para la posteridad"" y al comienzo de la película, somos tratados con las entrevistas necesarias con sus padres, la Madre Bajada Mina, y menos que el próximo papá, Mike . Inmediatamente encontré esta pareja interesante y no tenía idea de dónde nos iba a llevar el cineasta (hijo de Mike y Mina Doug). De hecho, dudo que Doug mismo supiera a dónde iba con esto! La vida toma giros y giros inesperados y esta película bellamente expresiva sigue el viaje. Es difícil verbalizar cuán movido estaba con esta historia y la forma única en la que se le dijo. Absolutamente avanzando de principio a fin y realmente es una visita obligada incluso si no eres un fanático del género documental. Esta película te hará pensar en tu propia vida e incluso podría evocar recuerdos que pensó que había olvidado durante mucho tiempo. ""51 Birch Street"" es una de esas raras experiencias de películas que causan una profunda impresión y nunca te deja. La mejor noticia de todo es que HBO tenía una mano en la producción, por lo que en lugar de jugar a una audiencia de arte limitada, finalmente, millones de personas tendrán la oportunidad de ver esta increíble pieza de trabajo. ¡¡¡¡¡¡¡¡BRAVO!!!!!!!!",positive,positivo
80,"Stephen Hawkings is a genius. He is the king of geniuses. Watching this movie makes me feel dumb. But it's a great movie. Not highly entertaining, but very very intriguing. The movie centers around wheelchair bound Stephen Hawkings, a man who makes Einstein look average, and his theories and scientific discoveries about the universe, time, the galaxy, and black holes. Everyone at sometime or another during a really intense high comes to a moment when they think they'v got the universe and the cosmos figured out and they swear as soon as they sober up they'll write it all down. Well here is a man who actually held that feeling for more then six hours. Here is a man who despite suffering from Lou Gehrig's disease has become the greatest mind the world has yet seen. Watch this and listen in on how he has formulated theories on black holes. Awesome. You won't be the same after you see it.","Stephen Hawkings es un genio.Él es el rey de los genios.Ver esta película me hace sentir tonta.Pero es una gran película.No es muy entretenido, pero muy muy intrigante.Los centros de cine alrededor de la silla de ruedas en Stephen Hawkkings, un hombre que hace que Einstein se vea promedio, y sus teorías y descubrimientos científicos sobre el universo, el tiempo, la galaxia y los agujeros negros.Todos, en algún momento u otro, durante un alto intenso, llegan a un momento en el momento en que piensan que obtuvieron el universo y el cosmos se descubrió y lo juran tan pronto como se sobrio, lo descubieran.Bueno, aquí hay un hombre que realmente sostuvo ese sentimiento por más de las seis horas.Aquí hay un hombre que a pesar del sufrimiento de la enfermedad de Lou Gehrig se ha convertido en la mente más grande que el mundo aún ha visto.Mira esto y escucha cómo ha formulado teorías en los agujeros negros.Impresionante.No serás igual después de verlo.",positive,positivo
81,"The story is about a psychic woman, Tory, who returns to her hometown and begins reliving her traumatic childhood past (the death of her childhood friend and abusive father). Tory discovers that her friend was just the first in a string of murders that are still occurring. Can her psychic powers help solve the crimes and stop the continuing murders? You really don't need to find out because, Oh My God! This was so so so so bad! I know all the Nora Roberts fans will flock to this movie and give it tons of 10's. Then the rest of us will see an IMDb score of 6 and actually think this movie is worth watching. But do not be fooled. The ending was predictable, the acting TERRIBLE (don't even get me started about the southern accents *y'all*) and the story was trite. Just remember....you were warned!","La historia es sobre una mujer psíquica, Tory, que regresa a su ciudad natal y comienza a revivir su pasado de la infancia traumática (la muerte de su amigo de su infancia y padre abusivo).Tory descubre que su amiga fue la primera en una cadena de asesinatos que aún están ocurriendo.¿Pueden sus poderes psíquicos ayudar a resolver los delitos y detener los asesinatos continuos?¡Realmente no necesitas averiguarlo porque, oh Dios mío!¡Esto fue tan tan malo!Sé que todos los fanáticos de Nora Roberts acuden a esta película y le darán toneladas de 10.Luego, el resto de nosotros verá una puntuación IMDb de 6 y, en realidad, creo que vale la pena ver esta película.Pero no se deje engañar.El final era predecible, lo que actúa terrible (ni siquiera me enteré de los acentos del sur * y la historia era trillada.Solo recuerda ... ¡Fuiste advertido!",negative,negativo
