,review_en,review_es,sentiment,sentimiento
117,"Usually I'm a bit of a fan of the bad eighties & early nineties film featuring now has beens...but this film is so incredibly terrible that it was a real endurance test to sit through. Guys dressing up as girls has been done to death - but never so pathetically. Corey Haim's performance was abysmal as usual, Nicole Eggert was not much better. This has no redeeming qualities, even if you are a number #1 fan of an actor/actress in this piece of trash - stay away!","Por lo general, estoy un poco fanático de los increíbles de los años ochenta y las primeras noventa. La película que ofrece ahora tiene beta ... pero esta película es tan increíblemente terrible que fue una verdadera prueba de resistencia para sentarse.Los chicos se visten cuando las chicas se han hecho hasta la muerte, pero nunca tan patéticamente.El rendimiento de Corey Haim fue abismal como de costumbre, Nicole Eggert no era mucho mejor.Esto no tiene cualidades de redención, incluso si usted es un fan número 1 de un actor / actriz en esta pieza de basura, ¡manténgase alejado!",negative,negativo
118,"I have now seen quite a few films by Pedro Almodóvar, but this would have to be the most disappointing so far. This film seemed to lack the zaniness that is usually everywhere in his films, and the story just never got me interested. Many Almodóvar regulars appear in this film, so it's not like there was a lack of on-screen talent, but this film just seemed more serious than his other films. If there was a comedic edge to this movie, I certainly couldn't find it, and it made for one surprisingly weak movie.","Ahora he visto algunas películas de Pedro Almodóvar, pero esto tendría que ser el más decepcionante hasta ahora.Esta película parecía carecer de la zanidad que suele ser en todas partes en sus películas, y la historia nunca me interesó.Muchos regulares de Almodóvar aparecen en esta película, por lo que no es como si hubiera una falta de talento en pantalla, pero esta película simplemente parecía más seria que sus otras películas.Si hubiera un borde cómico a esta película, ciertamente no pude encontrarlo, y se hizo para una película sorprendentemente débil.",negative,negativo
119,"I greatly enjoyed Margaret Atwood's novel 'The Robber Bride', and I was thrilled to see there was a movie version. A woman frames a cop boyfriend for her own murder, and his buddy, an ex-cop journalist, tries to clear his name by checking up on the dead woman's crazy female friends. It's fortunate that the movie script fixes Ms. Atwood's clumsy plotting by focusing on the story of these two men, victims of scheming women...Heh. Okay, you got me. If these guys are mentioned in the book, and I'm pretty sure they're entirely made up for the movie, I'll eat the dust cover of my hardback copy. Apparently, the three main female characters of the novel aren't enough to carry the movie. Zenia's manipulations aren't interesting unless we see them happen to a man, and a man's life is screwed up. Roz, Charis, and Toni tell their stories -- to a man. Because it's not important if a man doesn't hear them.I liked the characters in the book. It hurts to see them pushed off to the side for a man's story. I normally do not look for feminist angles on media, and I tried to enjoy the movie as is. If I hadn't read the book, I might have enjoyed the movie a lot more. So if you like the cop and the ex-cop, and you want to read more about them, you're out of luck. Read the novel, if you want to enjoy luscious prose and characterization subtly layered through a plot. It's the same plot: the movie excavated it, ironed it, and sprinkled it with male angst. It's like Zenia's revenge on Margaret Atwood.","Disfruté mucho la novela de Margaret Atwood 'The Robber Bride', y estaba encantada de ver que había una versión de película. Una mujer marca a un novio de policía para su propio asesinato, y su amigo, un ex periodista de la policía, trata de limpiar su nombre al revisar las locas amigas locas de la mujer muerta. Es afortunado que el script de la película corrige la trama torpe de la Sra. Atwood centrándose en la historia de estos dos hombres, las víctimas de las mujeres del esquema ... je. Está bien, me tienes. Si estos tipos se mencionan en el libro, y estoy bastante seguro de que están totalmente compensados ​​para la película, comeré la cubierta de polvo de mi copia dura. Aparentemente, los tres personajes femeninos principales de la novela no son suficientes para llevar la película. Las manipulaciones de Zenia no son interesantes a menos que los vemos que les sucedan a un hombre, y la vida de un hombre está jodida. Roz, Charis y Toni cuentan sus historias, a un hombre. Porque no es importante si un hombre no las oye. Me gustó los personajes del libro. Duele verlos empujados hacia un lado para la historia de un hombre. Normalmente no busco ángulos feministas en los medios de comunicación, y traté de disfrutar de la película como está. Si no hubiera leído el libro, podría haber disfrutado mucho más. Entonces, si te gusta el policía y el ex policía, y quieres leer más sobre ellos, estás fuera de la suerte. Lea la novela, si desea disfrutar de la deliciosa prosa y la caracterización en capas sutiles a través de una parcela. Es la misma parcela: la película la excavó, la planchó y la roció con angustia masculina. Es como la venganza de Zenia en Margaret Atwood.",negative,negativo
120,this movie gets a 10 because there is a lot of gore in it.who cares about the plot or the acting.this is an Italian horror movie people so you know you can't expect much from the acting or the plot.everybody knows fulci took footage from other movies and added it to this one.since i never seen any of the movies that he took footage from it didn't matter to me.the Italian godfather of gore out done himself with this movie.this is one of the goriest Italian movies you will ever see.no gore hound should be without this movie in their horror movie collection.buy this movie no matter what it is a horehounds dream come true.,"Esta película obtiene un 10 porque hay una gran cantidad de Gore. Quien se preocupa por la parcela o la actuación. Esta es una gente de cine de horror italiano para que sepa que no puede esperar mucho de la actuación o la trama. Todo el mundo conoce a FulciTomó imágenes de otras películas y se lo agregó a este, ya que nunca he visto ninguna de las películas de las que tomó las imágenes, no me importó. El padrino italiano de Gore Out se hizo con esta película. Este es uno de losPelículas italianas más goledes que jamás verás. No se debe tener una caza de Gore sin esta película en su colección de películas de terror. Esta película no importa lo que sea un sueño de Horehounds.",positive,positivo
121,"Ingrid Bergman, playing dentist Walter Matthau's faithful receptionist who harbors a little crush on her boss, is absolutely wonderful in this film. She handles the witty repartee in the script with aplomb and steals a terrific scene where she and Goldie Hawn talk in a record booth (Ingrid's monologue is a front, but her face tells you she believes in it with all her heart). Matthau is an odd choice for the leading man (he's too old for Goldie Hawn and too unrefined for Bergman, not to mention too unfocused to be a dentist), but I liked the way he tries hard to please Goldie and stumbles around trying to free himself from a lie. Hawn (who won a Supporting Oscar) is just as fresh and bubbly as she is today. This bedroom farce isn't terribly sophisticated (and faintly reminds one of ""Any Wednesday"" besides), but it's a welcome relief from the noisy, teen-oriented comedies they turn out today. ""Cactus Flower"" is a lovely sigh! *** from ****","Ingrid Bergman, jugando al dentista, la recepcionista fiel de Matthau, que alberga un poco a su jefe, es absolutamente maravilloso en esta película.Ella maneja el ingenioso reparador en el guión con Aplomb y roba una escena excelente donde ella y Goldie Hawn hablan en una cabina discográfica (el monólogo de Ingrid es un frente, pero su rostro le dice que cree en él con todo su corazón).Matthau es una opción extraña para el hombre líder (es demasiado viejo para Goldie Hawn y demasiado sin refinar para Bergman, por no mencionar demasiado para ser un dentista), pero me gustó la forma en que intenta con dificultad para complacer a Goldie y tropieza tratando de liberarél mismo de una mentira.Hawn (que ganó un Oscar de apoyo) es tan fresco y burbujeante como ella es hoy.Esta habitación Farce no es terriblemente sofisticada (y le recuerda débilmente uno de ""cualquier miércoles"" además), pero es un alivio bienvenido de las comedias ruidosas y orientadas al adolescente que salen hoy.""Cactus Flower"" es un hermoso suspiro!*** de ****",positive,positivo
122,"""A bored television director is introduced to the black arts and astral projection by his girlfriend. Learning the ability to separate his spirit from his body, the man finds a renewed interest in his life and a sense of wellbeing. Unfortunately, the man discovers while he is sleeping, his spirit leaves his body and his uncontrolled body roams the streets in a murderous rampage,"" according to the DVD sleeve's synopsis.The synopsis isn't entirely correct, as it turns out.Anyway, the movie opens with a dizzying ""out-of-body"" example of handsome director Winston Rekert (as Paul Sharpe)'s newly discovered ""astral body"" experience; it also foreshadows an upcoming dogfight. Young Andrew Bednarski (as Matthew Sharpe), being a kid, draws pictures of ""The Blue Man"", as his murder spree begins. Handsome detective John Novak (as Stewart Kaufman) discovers the victims are connected to Mr. Rekert. Mr. Novak's investigation leads to the supernatural; a prime example of which is Karen Black (as Janus), with whom Rekert fears he is falling in love.Several in the cast perform well; but, ""The Blue Man"" winds up tying itself up in a knot. Aka ""Eternal Evil"", its unsatisfying story tries to be far too clever for its own good.","""Un director de televisión aburrido se presenta a las artes negras y la proyección astral por su novia. Aprendiendo la capacidad de separar su espíritu de su cuerpo, el hombre encuentra un interés renovado en su vida y un sentido de bienestar. Desafortunadamente, el hombre descubre mientras Él está durmiendo, su espíritu deja su cuerpo y su cuerpo incontrolado deambula por las calles en un alboroto asesino, ""de acuerdo con la sinopsis de la funda de DVD. La sinopsis no es del todo correcta, por lo que resulta. En su lugar, la película se abre con una vertiginosa. ""Fuera de cuerpo"", ejemplo del director guapo Winston Rekert (como la experiencia del cuerpo astral ""de Paul Sharpe); También presagia una próxima pelea de perros. Joven andrew Bednarski (como Matthew Sharpe), siendo un niño, dibuja fotos de ""The Blue Man"", como comienza su juerga de asesinato. Hermoso detective John Novak (como Stewart Kaufman) descubre que las víctimas están conectadas al Sr. Rekert. La investigación del Sr. Novak lleva a lo sobrenatural; Un excelente ejemplo de lo que es Karen Black (como Janus), con quien rekert teme que se está enamorando. Evierte en el reparto. Pero, ""el hombre azul"" se vincula atándose en un nudo. Aka ""Eternal Evil"", su historia insatisfactoria trata de ser demasiado inteligente por su propio bien.",negative,negativo
123,"Ah yes the 1980s , a time of Reaganomics and Sly , Chuck and a host of other action stars hiding in a remote jungle blowing away commies . At the time I couldn`t believe how movies like RAMBO , MISSING IN ACTION and UNCOMMON VALOR ( And who can forget the ridiculous RED DAWN ? ) made money at the box office , they`re turgid action crap fests with a rather off putting right wing agenda and they have dated very badly . TROMA`S WAR is a tongue in cheek take on these type of movies but you`ve got to ask yourself did they need spoofing in the first place ? Of course not . TROMA`S WAR lacks any sort of sophistication - though it does make the point that there`s no real difference between right wing tyrants and left wing ones - and sometimes feels more like a grade z movie than a send up . Maybe it is ?","Ah, sí, la década de 1980, una época de reajanómica y astuto, Chuck y una gran cantidad de otras estrellas de acción que se esconden en una selva remota que sopla los comidas.En el momento en que no pude creer cómo las películas como RAMBO, Faltan en acción y valor incondicional (¿y quién puede olvidar el ridículo amanecer rojo?) Hizo dinero en la taquilla, son festivales de la mierda de acción turgínea con un derecho de apagado.Agenda de ala y han fechado muy mal.La guerra de Troma es una lengua en la mejilla, asume este tipo de películas, pero tiene que preguntarse, ¿necesitaban una falsificación en el primer lugar?Por supuesto que no .La guerra de Troma carece de cualquier tipo de sofisticación, aunque hace el punto de que no hay una diferencia real entre los tiranos de derecha y los de izquierda, y a veces se siente más como una película de grado Z que un envío.Tal vez es?",negative,negativo
124,"This tale based on two Edgar Allen Poe pieces (""The Fall of the House of Usher"", ""Dance of Death"" (poem) ) is actually quite creepy from beginning to end. It is similar to some of the old black-and-white movies about people that meet in an old decrepit house (for example, ""The Cat and the Canary"", ""The Old Dark House"", ""Night of Terror"" and so on). Boris Karloff plays a demented inventor of life-size dolls that terrorize the guests. He dies early in the film (or does he ? ) and the residents of the house are subjected to a number of terrifying experiences. I won't go into too much detail here, but it is definitely a must-see for fans of old dark house mysteries.Watch it with plenty of popcorn and soda in a darkened room.Dan Basinger 8/10","Este cuento basado en dos piezas de Poe de Edgar Allen (""La caída de la casa de la casa"", ""Danza de la muerte"" (poema)) es en realidad bastante espeluznante de principio a fin.Es similar a algunas de las antiguas películas en blanco y negro sobre las personas que se encuentran en una antigua casa decrépita (por ejemplo, ""el gato y el canario"", ""la vieja casa oscura"", ""noche de terror"", etc.).Boris Karloff juega un inventor de muñecas de tamaño natural que aterroriza a los invitados.Muere temprano en la película (¿o él?) Y los residentes de la casa están sujetos a una serie de experiencias aterradoras.No voy a entrar demasiado detalle aquí, pero definitivamente es una visita obligada para los fanáticos de los viejos misterios de la Casa Oscura. Es una gran cantidad de palomitas de maíz y refrescos en una habitación oscura.Dan Basinger 8/10",positive,positivo
125,"I am so happy and surprised that there is so much interest in this movie! Jack Frost was my introduction into the films produced and distributed by A-pix entertainment, and without exception, everything this company deals with is pure crap! First, and this is very important, never ever watch this movie sober! Why would you? Unlike many other entertaingly bad movies, this one I feel was made intentionally bad. I just can't get over how fake the snowman is, which is why its always shown only briefly, the way it moves is the best! This movie is Waaaaaaaaaaay better than the Michael Keaton piece of crap, becuz that was made too be a good movie, and that version is as bad as this.","¡Estoy tan feliz y sorprendido de que haya tantos intereses en esta película!Jack Frost fue mi introducción en las películas producidas y distribuidas por A-Pix Entertainment, y sin excepción, ¡todo lo que se ocupa de esta compañía es una mierda pura!Primero, y esto es muy importante, ¡nunca ve a esta película sobrio!¿Por que lo harias?A diferencia de muchas otras películas enteradas, esta que siento, se hizo intencionalmente mala.Simplemente no puedo superar lo falso que está el muñeco de nieve, por lo que siempre se muestra brevemente, ¡la forma en que se mueve es la mejor!Esta película es Waaaaaaaaaaaay mejor que la pieza de Michael Keaton, Becuz, que también fue una buena película, y esa versión es tan mala como esta.",negative,negativo
126,"""Revolt of the Zombies"" proves that having the same director revamp and recycle an idea doesn't necessarily make lightning strike twice.The Halperin brothers, responsible for the horror classic ""White Zombie"", made this trite piece of garbage a mere few years later to cash in on its popularity and even recycled close-ups of Lugosi's eyes from that previous film. There was a court battle with the ""White Zombie"" film's rights owners, who didn't want the Halperins to be able to use the word 'zombie' in this title. That word was the only thing that could help this film, because, as everyone knows, bad films can make much more money simply by having the word 'Zombie' appear in the title. Knowing what Victor Halperin was capable of a few years before only makes this uninteresting film more insulting. It seems he never directed another horror film after this debacle. The zombies here seem not to be true walking dead, but simply hypnotism victims.Wanna create a mind-controlled army of zombies? Be ready to crack a few eggs, including your own.THE LAME PLOT: Man falls in love with scheming woman who plays with his heart and becomes engaged to him only to make his friend, whom she loves, jealous. This sends man into a spiral of madness in which he tries using zombie mind-control techniques to change things to his advantage in an attempt to win over a woman who isn't worth spit.This includes one of the most blatantly obvious plot developments I've ever seen. You'd have to be blind or stupid not to see the ending coming. The acting isn't even good. This movie makes the racially insensitive ""King of the Zombies"" (which appeared on the same double bill DVD I bought) seems like an atmospheric horror masterpiece by comparison and reminds us that not every black and white film is a classic. It makes the atomic age sci-fi alien zombie cheese fest ""Invisible Invaders"" seem like a serious drama. This is one big ball of cheese so ridiculously melodramatic it could probably make many a Korean film fan twitch (South Korean films are often known for their use of melodrama). The credits list the ironically named company Favorite Films. I'm not sure whose favorite film this would be, but they're obviously an idiot.Not recommended for fans of: zombies, romance, or classic films.","""La revuelta de los zombies"" prueba que tener la misma directora renovar y reciclar una idea no necesariamente dificulta el rayo dos veces. Los Halperin Brothers, responsables del clásico de horror ""Zombie White"", hicieron este triple pieza de basura a unos pocos años. Más tarde, en efectivo de su popularidad e incluso reciclados los primeros primeros de los ojos de Lugosi de esa película anterior. Hubo una batalla de la corte con los propietarios de derechos de la película ""Blanco Zombie"", que no querían que los Halperins pudieran usar la palabra ""zombie"" en este título. Esa palabra era lo único que podría ayudar a esta película, porque, como todos saben, las películas malas pueden ganar mucho más dinero simplemente haciendo que la palabra ""Zombie"" aparezca en el título. Sabiendo lo que Victor Halperin fue capaz de unos años antes, solo hace que esta película no interesante sea más insultante. Parece que nunca dirigió otra película de terror después de esta debacle. Los zombies aquí parecen ser verdaderos caminando muertos, sino simplemente víctimas de hipnotismo. ¿Janna la creación de un ejército de zombies controlado por la mente? Esté preparado para romper unos huevos, incluido el suyo. La parcela coja: el hombre se enamora de la mujer del esquema que juega con su corazón y se compromete con él solo para hacer a su amigo, a quien ama, celosa. Esto le envía a un hombre a una espiral de locura en la que intenta usar las técnicas de control de la mente zombie para cambiar las cosas a su ventaja en un intento de ganar a una mujer que no vale la pena escupir. Esto incluye uno de los desarrollos de la trama más evidente. He visto nunca. Tendrías que ser ciego o estúpido para no ver la finalización. La actuación no es ni siquiera es buena. Esta película hace que el ""rey de los zombies"" racialmente insensible (que apareció en el mismo Doble Bill DVD que compré) parece una obra maestra de terror atmosférica en comparación y nos recuerda que no todas las películas en blanco y negro son un clásico. Hace que los ""invasores invisibles"" de Sci-Fi Atomic Sci-Fi Alien Zombie. Esta es una gran bola de queso tan ridículamente melodramática, probablemente podría hacer que muchos de los fanáticos de la película coreana (películas de Corea del Sur a menudo se conocen por su uso de Melodrama). Los créditos enumeran las películas favoritas de la compañía con nombre irónicamente. No estoy seguro de quién sería una película favorita, pero obviamente son un idiota. No se recomienda para los fanáticos de: zombies, romance o películas clásicas.",negative,negativo
127,"The complaints are valid, to me the biggest problem is that this soap opera is too aimed for women. I am okay with these night time soaps, like Grey's Anatomy, or Ugly Betty, or West Wing, because there are stories that are interesting even with the given that they will never end. However, when the idea parallels the daytime soaps aimed at just putting hunky men (Taye Diggs, Tim Daly, and Chris Lowell) into sexual tension and romps, and numerous ridiculous difficult situations in a so-called little hospital, it seems like General Hospital...or a female counterpart to Baywatch. That was what men wanted and they had it, so if this is what women want so be it, but the idea that this is a high brow show (or something men will watch) is unrealistic.","Las quejas son válidas, para mí, el mayor problema es que esta telenovela está demasiado dirigida a las mujeres.Estoy bien con estos jabones nocturnos, como la anatomía de Gray, o fea Betty, o West Wing, porque hay historias interesantes incluso con las que nunca terminarán.Sin embargo, cuando la idea paralela a los jabones diurnos dirigidos a simplemente poner hombres hunky (Taye Diggs, Tim Daly y Chris Lowell) en la tensión sexual y los juguetes, y numerosas situaciones difíciles ridículas en un pequeño hospital, parece un hospital general.... o una contraparte femenina a Baywatch.Eso fue lo que los hombres quería y lo tenían, así que si esto es lo que las mujeres quieren, así que es así, pero la idea de que este es un alto espectáculo de cejas (o algo que los hombres verán) no es realista.",negative,negativo
128,"This movie was one of the best movies that I have seen this year. I didn't see any cameos in the movie, but it is still pretty good. It is similar to Anchorman in the humor department, but I think this is a better put together movie. It actually has a point. If you are going to see a whole bunch of T&A you will be disappointed. Just a well put together movie!!!! If you have nothing to do for the day or you need a lot of humor, you will find this to be a really good movie. I definitely think that Ebert and Roeper's review of this movie is right on. I mean, I don't really like Ebert on most movies, but this is the movie that I will agree about. The movie contains a good enough story that it is actually believable that these type of people are out there. There is definitely something to be said about how they treat virginity in this movie. Yea, sure, you get laughed at when it is found out about, but it still suggests that you wait. Steve did a wonderful job of portraying the person that he did in this movie and yet, it is still funny.","Esta película fue una de las mejores películas que he visto este año. No vi ningún campeón en la película, pero sigue siendo bastante bueno. Es similar al Anchorman en el departamento de humor, pero creo que esta es una película mejor presentada. En realidad tiene un punto. Si vas a ver un montón de T & A, te decepcionará. Sólo una película bien presentada !!!! Si no tienes nada que hacer por el día o necesitas mucho humor, encontrarás que esta es una película realmente buena. Definitivamente creo que la revisión de Ebert y Roeper de esta película está justo. Quiero decir, realmente no me gusta Ebert en la mayoría de las películas, pero esta es la película de la que estaré de acuerdo. La película contiene una buena historia que es realmente creíble que este tipo de personas estén ahí fuera. Definitivamente, hay algo que decir sobre cómo tratan la virginidad en esta película. Sí, claro, te eches a reír cuando se descubre, pero todavía sugiere que espere. Steve hizo un trabajo maravilloso de retratar a la persona que hizo en esta película y, sin embargo, todavía es divertida.",positive,positivo
